{
  "version": 2,
  "currency": "PLN",
  "timezone": "Europe/Warsaw",
  "taxProfiles": [{"validFrom": "2026-01-01T00:00:00+01:00", "validTo": "2027-01-01T00:00:00+01:00", "profileId": "PL.HOUSEHOLD.2026"}],
  "billingCycles": [{
    "validFrom": "2026-01-01T00:00:00+01:00",
    "validTo": "2027-01-01T00:00:00+01:00",
    "anchor": "2026-01-15",
    "length": 1,
    "unit": "MONTH"
  }],
  "periods": [{
    "validFrom": "2026-01-01T00:00:00+01:00",
    "validTo": "2027-01-01T00:00:00+01:00",
    "components": [
      {"kind": "ENERGY_PURCHASE", "presetId": "PL.TAURON_SPRZEDAZ.G12.2026", "componentId": "energy-purchase", "values": {"energy.DAY": "0.98", "energy.NIGHT": "0.62"}},
      {"kind": "DISTRIBUTION_VARIABLE", "presetId": "PL.TAURON_DYSTRYBUCJA.G12.2026", "componentId": "distribution-variable", "values": {}}
    ]
  }]
}
